book_id,input,output
5_libro_La_Barraca,"Claro, ¡como a los hombres os cuesta menos esperar...!","Claro, ¡como a [los hombres: 1] [os: 1] cuesta menos esperar...!"
5_libro_La_Barraca,"Cuantas veces se lo pregunté, antes y después de casarnos, siempre me contestó: eso no se pregunta; es una tontería.","Cuantas veces [se: 2] lo pregunté, antes y después de casarnos, siempre [me: 2] contestó: [eso: 3] no se pregunta; es [una tontería: 3]."
5_libro_La_Barraca,Y Augusto se encontró pronunciando en voz alta el nombre de Eugenia.,Y [Augusto: 1] se encontró pronunciando en voz alta el [nombre de [Eugenia: 3]: 2].
5_libro_La_Barraca,Eramos dos mozuelos que vivían juntos haciendo eso que se llama vida marital.,Eramos [dos mozuelos: 1] que vivían juntos haciendo [eso que se llama vida marital: 2].
5_libro_La_Barraca,"No está nunca en donde debe estar, que es a lo que está, y habla para mentir y se viste!","No está nunca en donde debe estar, que es a lo que está, y habla para mentir y [se: 1] viste!"
5_libro_La_Barraca,Toda recta es curva de una circunferencia de radio infinito y en el infinito cierra.,Toda [recta: 1] es curva de [una circunferencia de radio infinito: 2] y en [el infinito: 3] cierra.
5_libro_La_Barraca,"Cuando desperté fuí a la puerta de la suya, donde ignoro si tiene usted hogar o no le tiene.","Cuando desperté fuí a [la puerta de [la suya: 2]: 1], donde ignoro si tiene usted hogar o no le tiene."
5_libro_La_Barraca,"Sentía la pobre oscuramente, sin darse de ello clara cuenta, que la música es preparación eterna, preparación a un advenimiento que nunca llega, eterna iniciación que no acaba cosa.","Sentía [la pobre: 1] oscuramente, sin darse de [ello: 2] clara cuenta, que [la música es preparación eterna, preparación a un advenimiento que nunca llega, eterna iniciación que no acaba cosa: 3]."